id	timestamp	hypothesis	balanced_accuracy	mcc	ece	top_5_accuracy	cross_branch_error_rate	within_branch_error_rate	precision_macro	recall_macro	best_so_far	status	duration_s	commit_sha	analysis_excerpt	error
1	2026-05-10T00:09:11+00:00	baseline	0.779000								0.779000	KEPT	4037	396a401		
1	2026-05-10T02:03:39+00:00	baseline	0.780000								0.780000	KEPT	3874	83bc6d1		
2	2026-05-10T21:35:18+00:00	Increasing learning_rate_init from 1e-4 to 3e-4 will allow the (500, 300, 100) MLP to make larger gradient steps and reach a deeper minimum before early stopping triggers, addressing the apparent undertraining (training_loss still decreasing at final epoch, val_loss plateauing after only 9 epochs).	0.785000	0.823000	0.092017	0.943650	0.730843	0.269157	0.790000	0.785000	0.785000	KEPT	2051	5c14323	The last experiment achieved balanced_accuracy=0.724 — well below the 0.78 baseline mentioned for the prior dataset. Sev	
7	2026-05-11T05:25:33+00:00	Adding label_smoothing=0.1 to the cross-entropy loss will prevent the model from placing extreme probability mass on its top prediction, directly attacking the +0.12–0.17 over-confidence gap in mid bins (3–5), restoring residual probability for rare/cross-branch classes that currently lose to siblings (Pectinia→Sponge 100%, Silt→Rubble 40%, Acropora cervicornis→Gorgonian 28%), and reducing the 0.44 train/val loss gap that dropout=0.3 alone failed to close.	0.766000	0.826000	0.090359	0.942295	0.745964	0.254036	0.830000	0.766000	0.797000	REVERTED	3820	5759bcd	The most recent experiment (Exp 6: cosine annealing on top of dropout=0.3, balanced_accuracy=0.796, REVERTED) reveals tw	
15	2026-05-11T20:58:34+00:00	Adding LayerNorm after each hidden Linear (before ReLU+Dropout) will stabilize per-sample activation statistics across the network's depth, improve gradient conditioning and feature learning on top of the current dropout=0.3 + AdamW(weight_decay=0.01) baseline, and reduce the mid-bin overconfidence (bins 3–5 gaps +0.14–0.15) that drives the dominant cross-branch confusions.	0.794000	0.820000	0.089357	0.942863	0.719552	0.280448	0.758000	0.794000	0.800000	REVERTED	6155	4fc1823	Experiment 14 (gradient clipping with max_norm=1.0 on top of AdamW + dropout=0.3 + LR=3e-4) finished at balanced_accurac	
